{"document_id":"doc-fictional-001","status":"PUBLISHED","active":true,"current_version_id":"ver-fictional-001","metadata":{"official_title":"Văn bản hư cấu dùng kiểm thử","document_number":"VB-TEST-001","canonical_url":"https://example.invalid/legal/doc-fictional-001","jurisdiction_code":"VN_TEST","document_class_code":"TEST","issuer_code":"TEST_ISSUER"},"effect_confirmation":{"confirmed":true,"confirmed_at":"2026-08-13T00:00:00Z","confirmed_by":{"actor_id":"actor-reviewer-001","actor_kind":"HUMAN"},"provenance":{"id":"prov-effect-001","hash":"sha256:test-effect-0001"}},"revision":1,"changed_at":"2026-08-13T00:00:00Z"}
